,Papel,Segmento,Cotação,FFO Yield,Dividend Yield,P/VP,Valor de Mercado,Liquidez,Qtd de imóveis,Preço do m2,Aluguel por m2,Cap Rate,Vacância Média,Endereço
0,AAZQ11,Títulos e Val. Mob.,"9,60","4,51%","7,90%","1,00",230.758.000,869.136,0,"0,00","0,00","0,00%","0,00%",
1,BLCA11,Lajes Corporativas,"137,00","4,91%","4,83%","1,00",219.200.000,67.540,1,"53.733,40","3.102,57","5,77%","0,00%","Avenida Brigadeiro Faria Lima, 3477, Itaim Bibi, Sao Paulo/SP, Brasil, 04538-133"
2,BRCO11,Logística,"118,00","6,79%","6,72%","0,98",1.743.900.000,4.149.090,11,"3.226,31","308,67","9,57%","12,06%","Rua Olympia Semeraro, nº 381, 675 e 737, São Paulo - SP,Estrada Turística do Jaraguá, nº 50, Jaraguá, São Paulo - SP,Rodovia Dom Gabriel Paulino Bueno Couto, nº 1606, Itupeva - SP,Avenida Tabai-Canoas (BR 386), nº 1.200, Canoas - RS,Avenida Marginal Direita do Tietê, nº 342, São Paulo - SP,Avenida D com acesso a Rodovia Presidente Dutra, KM 298, Resende - RJ,Avenida Wilson Tavares Ribeiro, nº 1.651 - Contagem - MG,Rodovia Dom Gabriel Paulino Bueno Couto nº 1936 - Itupeva - SP,Rua Eugênia S. do Rosário, 2800, Londrina - PR,Avenida Helio Ossamu Daikuara nº 1.135, Embu das Artes - SP,Rod. BA-535. km 23, Lauro de Freitas - BA"
3,BREV11,Híbrido,"95,00","7,21%","7,69%","0,81",91.884.100,2.375,13,"16.574,00","1.425,56","8,60%","0,00%","Rua Joaquim Floriano, 413 - São Paulo/SP,Rua Gomes de Carvalho, 1356 - São Paulo/SP,Rua Joaquim Floriano, 100 - São Paulo/SP,Rua Cristiano Viana, 401 - São Paulo/SP,Avenida Brigadeiro Faria Lima, 2055 - São Paulo/SP,Alameda Santos, 1940 - São Paulo/SP,Rua Tabapuã, 500,Rua Fidêncio Ramos, 213 - São Paulo/SP,Alameda Itu, 852 - São Paulo/SP,Rua James Joule, 92 - São Paulo/SP,Avenida Brigadeiro Faria Lima, 3015 - São Paulo/SP,Avenida Doutor Cardoso de Melo, 1336 - São Paulo/SP,Rua Helena, 260 - São Paulo/SP"
4,BTCI11,Títulos e Val. Mob.,"9,18","17,11%","7,92%","0,90",913.604.000,2.080.100,0,"0,00","0,00","0,00%","0,00%",
5,BTSG11,Híbrido,"115,00","13,26%","6,68%","0,84",89.126.700,166.472,1,"4.725,15","681,21","14,42%","0,00%","Avenida dos Alecrins, 430, Distrito Industrial, Pouso Alegre, Minas Gerais, Brasil"
6,CCME11,Outros,"128,05","3,86%","5,44%","1,26",384.073.000,178,1,"25.947,00","35,42","0,14%","0,00%","Avenida Vieira De Carvalho, 99, Sem Complemento, Republica, Sao Paulo/SP, Brasil, 01210-010"
7,CNES11,Lajes Corporativas,"28,29","4,72%","4,58%","0,32",83.434.200,4.696,1,"1.198,68","180,32","15,04%","54,60%","Avenida Maria Coelho Aguiar, 215, Jardim Sao Luis, Sao Paulo/SP, Brasil, 05805-000"
8,CRAA11,Títulos e Val. Mob.,"103,76","9,98%","4,46%","1,02",31.128.000,112.916,0,"0,00","0,00","0,00%","0,00%",
9,DOVL11B,Lajes Corporativas,"1.200,69","5,70%","6,45%","1,00",79.733.000,1.090,2,"4.561,26","612,18","13,42%","29,50%","Av.Gen. Justo, 375, Centro, Rio de Janeiro - RJ,Av.Gen. Justo, 365, Centro, Rio de Janeiro - RJ"
10,EDGA11,Lajes Corporativas,"21,05","7,19%","7,23%","0,34",80.243.800,37.630,1,"3.190,35","353,99","11,10%","41,24%","Rua Da Quitanda, 86, Centro, Rio De Janeiro/RJ, CEP 20091005"
11,ERPA11,Lajes Corporativas,"119,00","5,86%","6,59%","0,87",59.609.700,30.562,1,"17.642,00","1.382,98","7,84%","0,00%","Avenida Europa, 105 - Jardim Paulista"
12,FLMA11,Híbrido,"139,00","7,86%","7,66%","0,87",191.913.000,80.792,2,"11.016,40","951,66","8,64%","0,00%","Rua Tabapuã, 500,RUA DAS OLIMPIADAS, 205"
13,FLRP11,Shoppings,"1.848,98","7,62%","7,99%","1,01",120.613.000,8.541,1,"2.457,35","197,99","8,06%","2,92%","Rodovia Virgílio Várzea, 587 - Saco Grande II, Florianópolis - SC"
14,FTCE11B,Híbrido,"2.900,89","-2,38%","4,11%","0,99",2.811.560.000,343,61,"2.177,25","47,64","2,19%","0,00%","Rua Dom Gerardo nº42, centro, Rio de Janeiro,Av. Presidente Antonio Carlos, 51, centro , Rio de Janeiro,Gleba III da Rua de Acesso 2º Seguimento (Rua Projetada) - Niterói, RJ,Rua Conde de Bonfim nº149, centro, Rio de Janeiro,Rua das Laranjeiras, 149, Laranjeiras, Rio de Janeiro - RJ,Rua Barão da Torre, nº 662,Travessa do Ouvidor nº9, centro, Rio de Janeiro,Fazenda cachoeirinha, Bom Despacho, Minas Gerais,Avenida Santos Dumont, 979, Setor Oeste, Itumbiara - GO,Rodovia Darly Santos - Vila Velha - ES,R. Abiail do Amaral Carneiro, 85 - Enseada do Suá, Vitória - ES,Rua Assunção 260, Botafogo,R. Machado de Assis, 40 - Flamengo, Rio de Janeiro - RJ, 22220-060,Rua Sete de Setembro nº155, centro, Rio de Janeiro,Praia Rasa, Búzios - RJ,Praia Rasa, Buzios - RJ,Rua Buenos Aires nº48, centro, Rio de Janeiro,Rua Conde de Irajá, nº 439, Botafogo, Rio de Janeiro - RJ,Praia Rasa, Búzios - RJ,Rua Dom Gerardo nº46, centro, Rio de Janeiro,Rua Primeiro de Março nº19, centro, Rio de Janeiro,Sorocaba, 420, 422 e 436,Rodovia Darly Santos, S/n°, Gleba I, Vila Velha – ES,Avenida Marechal Camara nº160, centro, Rio de Janeiro,Alberto de Campos, 100,Rua Uruguaiana nº 76, centro, Rio de Janeiro,Avenida das Americas Nº700, barra da tijuca, Rio de Janeiro,Largo de Santa Rita, 10, Centro, Rio de Janeiro,Rua Visconde de Pirajá, 484 e 486,Rua Arturo Toscanini, Belo Horizonte - MG,Rua Teófilo Otoni, 82. Centro. Rio de Janeiro.,Rua Ministro Raul Fernandes, 116, Botafogo, Rio de Janeiro - RJ,Rua Teofilo Otoni 24,Praia Rasa, Búzios - RJ,Av. Mem de Sá, 102, Centro, Rio de Janeiro.,Rua General Gois Monteiro, 49, Botafogo, Rio de Janeiro - RJ,Rodovia Amaral Peixoto, Km 107, Quadra 20, Lote 9, S/n - Balneario São Pedro, São Pedro da Aldeia,Praia Rasa, Búzios - RJ,Rua Guarda Mor Custódio, Centro, Itabira - MG,Rainha Guilhermina, 75 , Leblon,Visconde de Inhaúma, 95,Rua Elesbão Linhares, n 503, Vitória - ES,R. Euríco Manoel do Carmo, 2 - Charitas, Niterói - RJ,Sorocaba, 420, 422 e 436,Rua Uruguaiana nº 78, centro, Rio de Janeiro,Avenida das Americas Nº700, barra da tijuca, Rio de Janeiro,Rua Lineu de Paula Machado, 708, Lagoa, Rio de Janeiro - RJ,Avenida Epitácio pessoa, 3744 e 3800,Rua Jardim Botânico, 568 - Jardim Botanico, Rio de Janeiro - RJ,Rua da Carioca, centro, Rio de Janeiro,Rua do Matoso, 104, Tijuca, Rio de Janeiro - RJ,Av. Vereador Hermínio Moreira - Itaboraí, RJ,Praia Rasa, Búzios - RJ,Barão de Mesquita nº164, Rio de Janeiro,Setor Hoteleiro Norte, Quadra 01, Área Especial A, Brasília - DF,Rua Senhor do Passos nº107, centro, Rio de Janeiro,Praia Rasa, Búzios - RJ,Praia Rasa, Buzios - RJ,Rua Miguel Couto, 98,Avenida Rio Branco nº45, centro, Rio de Janeiro,Praia Rasa, Búzios - RJ"
15,HBCR11,Outros,"111,92","9,35%","5,48%","1,08",125.256.000,458.865,4,"7.612,56","654,56","8,60%","0,00%","Rua XV de novembro, número 2.805, bairro Glória, CEP 89216-201, da cidade de Joinville, Estado de Santa Catarina,Rodovia Raposo Tavares, número 6008, km 16, bairro Rio Pequeno, CEP 05576-000, da cidade de São Paulo, Estado de São Paulo,Avenida Adhemar Ferreira da Silva, s/n, Trevo da Rodovia Dom Pedro I (SP-065), Km 129, Vila Brandina, na Cidade de Campinas, Estado de São Paulo,Avenida I, número 208, Quadra B-37, Lote 02, bairro Jardim Goiás, CEP 74810-075, da cidade de Goiânia, Estado de Goiás"
16,HBRH11,Híbrido,"97,39","8,40%","7,69%","0,87",269.985.000,48.920,5,"8.948,21","838,75","9,37%","2,83%","Avenida Pereira Barreto nº 1.479, São Bernardo do Campo/SP, Rua Pequetita, 111, Cidade de São Paulo/SP, Av. Ayrton Senna, 2.500, Barra da Tijuca, na Cidade do Rio de Janeiro/RJ, Av. Domingos Odália Filho, 301, Cidade de Osasco/SP,Avenida Armando Lombardi, 400 Rio de Janeiro - RJ"
17,HGBS11,Shoppings,"210,00","7,86%","7,84%","0,95",2.100.000.000,1.829.490,12,"4.129,74","326,72","7,91%","6,83%","R Dr. João Ribeiro, 304 - Penha de França, São Paulo - SP,Rua Cap. Pacheco e Chaves, 313 - Mooca, São Paulo - SP,Av. Rio Negro, 1.100, Franca - SP,Rua Sete de Setembro, 555 - Suzano - SP,Rua Manoel da Nobrega, 712, Centro, Diadema - SP,Rua Conselheiro Moreira de Barros, 2.780, São Paulo - SP,Av. José Monteiro Figueiredo, 500 - Duque de Caxias, Cuiabá - MT,Av. Santa Barbara, 777 - Vila Mollon IV, Santa Bárbara D Oeste - SP,Av. das Nações Unidas, 4777, São Paulo - SP,Av. Rotary, 624 - Centro, São Bernardo do Campo - SP,BR-116, 236 - Rio Branco, Novo Hamburgo - RS,Av. Francisco Matarazzo s/n, Bloco B, São Paulo, SP"
18,HGPO11,Lajes Corporativas,"271,97","6,51%","6,89%","0,91",476.779.000,777.502,2,"37.664,60","2.683,23","7,12%","0,00%","Rua Amauri, 255 - São Paulo - SP,Rua Jerônimo da Veiga, 384 - São Paulo - SP"
19,HGRE11,Lajes Corporativas,"134,64","5,14%","7,14%","0,86",1.591.140.000,2.550.440,19,"7.244,56","523,49","7,23%","29,58%","Alameda Campinas, 1.070 - São Paulo - SP,Av Dr Chucri Zaidan, 2460 - São Paulo - SP,Av. Dolores Alcaraz Caldas, 90 - Porto Alegre - RS,Av. Presidente Vargas, 3.131 - Rio de Janeiro - RJ,Rua Verbo Divino, 1.488 - São Paulo - SP,Rua Martiniano de Carvalho, 851 - São Paulo - SP,Rua Flórida, 1.595 - São Paulo - SP,Avenida Brigadeiro Faria Lima, 1.355 - São Paulo - SP,Rua Alegria, 86 - São Paulo - SP,Av. Maria Coelho Aguiar, 215 - São Paulo - SP,Rua Antônio das Chagas, 1.657 - São Paulo - SP,Rua Lauro Muller, 116 - Rio de Janeiro - RJ,Rua Francisco Nunes, 1.395 - Curitiba - PR,Avenida Marcos Penteado Ulhôa Rodrigues, 939 - Barueri - SP,Avenida das Nações Unidas, 11.633 - São Paulo - SP,Rodovia Dom Pedro I, Km 69 - Atibaia - SP,Avenida Eng. Carlos Berrini, 105 - São Paulo - SP,Avenida Braz Leme, 1.000 - São Paulo - SP,Rua José Lari e Rua Pedro Mari, Lotes 13 a 23 - Taboão da Serra - SP"
20,HPDP11,Shoppings,"72,00","8,64%","7,62%","0,81",209.435.000,6.338,1,"1.646,43","153,70","9,34%","4,49%","Av. Guilherme Campos 500, Campinas - SP"
21,HSRE11,Híbrido,"103,00","7,07%","7,23%","1,07",916.569.000,361.146,27,"8.548,30","700,42","8,19%","0,00%","Cidade de Belo Horizonte, Minas Gerais, Rua Goitacazes, 182,Cidade de Goiânia, Goiás, na Avenida T-10, 1.300,Cidade de Salvador, Estado da Bahia, na Avenida Centenário, 2.992,Cidade de Recife, Pernambuco, na Avenida Conde da Boa Vista, 484,Cidade de Duque de Caxias, Rio de Janeiro, na Praça Pacificador, 39,Cidade de Brasília, Distrito Federal, no Setor Comercial Sul Q.6, Asa Sul,Cidade de São Paulo, São Paulo, na Av. São João, 455 e Rua 24 de Maio, 70/90,Cidade de Niterói, Rio de Janeiro, na Rua Quinze de Novembro, 08,Cidade de Campinas, São Paulo, na Rua Treze de Maio nº 520,Cidade de Fortaleza, Estado do Ceará, na Avenida Washington Soares, 85,Cidade de Salvador, Estado da Bahia, na Avenida Centenário, 2.992,Cidade do Rio de Janeiro, Rio de Janeiro, na Rua Barão de São Francisco, 236,Cidade de Nova Iguaçu, Rio de Janeiro, na Avenida Nilo Peçanha, 176 e 186,Cidade do Rio de Janeiro, Rio de Janeiro, na Rua Conde do Bonfim, 366,Cidade do Rio de Janeiro, Rio de Janeiro, na Avenida Nossa Senhora de Copacabana, 749,Cidade do Rio de Janeiro, Rio de Janeiro, na Avenida Dom Helder Câmara, 5.474,Cidade de São Paulo, São Paulo, na Av. São João, 455 e Rua 24 de Maio, 70/90,Cidade de Maceió, Estado de Alagoas, na Avenida Comendador Gustavo Paiva, 2.990,Alameda dos Tabajaras nº 50, na Cidade do Rio de Janeiro, Rio de Janeiro,Cidade de Curitiba, Paraná, na Rua Brigadeiro Franco, 2.300,Cidade de Santo André, São Paulo, na Avenida Pereira Barreto nº 42,Cidade do Rio de Janeiro, Rio de Janeiro, na Rua do Ouvidor, 186,Cidade de Vitória, Espírito Santo, na Avenida Jerônimo Monteiro, 1.000,Cidade de Belo Horizonte, Minas Gerais, Avenida Presidente Carlos Luz, 3.001,Cidade de Belém, Pará, na Travessa Padre Eutíquio, 1.078,Rua Oswaldo Cruz nºs 298 e 290; Rua Sete de Setembro nºs 615, 621, 627 e 631; Rua José Augusto Correa nº 295, e está situado na Cidade de São Luís do Maranhão, Maranhão,Cidade de Belo Horizonte, Minas Gerais, na Avenida Cristiano Machado, 4.000"
22,HUSI11,Hospital,"1.136,80","6,53%","7,72%","1,02",132.280.000,3.081,1,"6.620,16","445,90","6,74%","0,00%","Rua Ester Martins Bertozzo, com a Rodovia da Convenção (SP-40/70), no Bairro Canjica"
23,IAGR11,Títulos e Val. Mob.,"97,48","12,75%","7,29%","1,00",25.851.700,25.570,0,"0,00","0,00","0,00%","0,00%",
24,JASC11,Outros,"100,00","2,49%","4,52%","0,97",271.638.000,58.723,13,"2.788,09","32,94","1,18%","0,00%","Av. Washington Soares, 3535, Bairro: Edson Queiroz/ Fortaleza-CE,Avenida Sargento Hermínio, Ceara,Av. Antônio Cabral de Souza (Rod. PE-22), Maranguape, Paulista / PE,Avenida Eusebio de Queiroz, 4759, cidade de Eusebio, estado do Ceará.,Av. 13 de maio, 755, Bairro de Fátima - Fortaleza - CE,Avenida Sargento Hermínio, Ceara,Avenida Godofredo Maciel, 2540, cidade de Fortaleza, estado do Ceará.,Avenida Francisco Sa, 2670, cidade de Fortaleza, estado do Ceará.,Avenida Bernardo Manuel, 2915, cidade de Fortaleza, estado do Ceará.,Av Deputado Oswaldo Studart com a Treze de Maio, cidade de Fortaleza, estado do Ceará,Avenida Godofredo Maciel, nº 2.560,Av. Caxangá, 3.942, Caxangá, Recife / PE,Avenida Bezerra de Menezes, 1409, cidade de Fortaleza, estado do Ceará."
25,JSRE11,Híbrido,"77,50","7,35%","7,38%","0,69",1.609.470.000,2.617.970,6,"13.626,40","1.181,80","8,67%","8,21%","Rua Eugênio de Medeiros, 303, Pinheiros, São Paulo - SP,Av. Das Nações Unidas, 14171, São Paulo - SP,Av. Das Nações Unidas, 14171, São Paulo - SP,Av. Jornalista Roberto Marinho, 85, Cidade Monções, Sao Paulo - SP,Praia de Botafogo, 440, Botafogo, Rio de Janeiro - RJ,Av. Paulista, 2064, Bela Vista, São Paulo - SP"
26,KEVE11,Residencial,"1.080,00","0,58%","4,91%","1,17",159.517.000,62.776,0,"0,00","0,00","0,00%","0,00%",
27,KNRI11,Híbrido,"157,39","7,21%","7,01%","0,98",3.802.090.000,3.684.240,19,"4.975,73","407,90","8,20%","0,22%","Rod. Dom Gabriel Paulino Bueno Couto, km 82 - Cabreúva - SP28,42,Rua Voluntários da Pátria, 113, Botafogo, Rio de Janeiro - RJ,Avenida Caminho de Goiás, 100, Rodovia Anhanguera, km 66, Jundiaí - SP,Rua Humaitá, 275, Humaitá, Rio de Janeiro - RJ,Avenida Presidente Juscelino Kubitschek, 1.830, São Paulo - SP,Estrada da Lama Preta, 2.805, Santa Cruz, Rio de Janeiro - RJ,Rua do Níquel, 205, Parque Industrial, Itaquaquecetuba - SP,Avenida dos Andradas, 3000, Santa Efigênia, Belo Horizonte - MG,Rodovia Vice Prefeito Hermenegildo Tonolli, km 2, Jundiaí - SP,Rua Gomes de Carvalho, 1.195, Vila Olimpia, São Paulo - SP,Rua Diogo Moreira, 184, São Paulo - SP,Rua Dr. Fernandes Coelho, 64, Pinheiros, São Paulo - SP,Rodovia Mogi-Dutra (SP-088), 11.100 (km 41,4), Mogi das Cruzes - SP,Rua Buenos Aires, 15, Centro, Rio de Janeiro - RJ,Avenida Parque Industrial, 580, Sumaré - SP,Av. Nações Unidas, 14.171 , São Paulo - SP,Rua Joaquim Floriano, 913, Itaim Bibi, São Paulo - SP,Avenida Paulista, 2.421, Bela Vista, São Paulo - SP,Rodovia Fernão Dias, km 863, Algodão, Pouso Alegre - MG"
28,LVBI11,Logística,"115,00","8,03%","7,74%","1,00",1.354.150.000,2.601.780,9,"3.371,93","300,42","8,91%","0,98%","Avenida Juiz Marco Tulio Isaac, 7001, Riacho Da Areia, Betim/MG, Brasil, 32671-072,Avenida Papa Joao XXIII, 3059, Loteamento Industrial Coral, Mauá/SP, Brasil, 09370-800,Rodovia Fernão Dias, KM 947.5, Extrema, MG, 37640-000,Rua Pedro De Alcantara Meira, 1001, Fazenda Velha, Araucaria/PR, Brasil, 83704-530,Avenida Portugal, 400, Itaqui, Itapevi/SP, Brasil, 06696-060,Estrada Dos Alpes, 320, Jandira, Barueri/SP, Brasil, 00006-423,Rodovia Anhanguera, km 43, Cajamar, São Paulo,Avenida Mutinga 4935, Bairro Pirituba, Pirituba, São Paulo/SP, Brasil, 05110-903,Rua Manoel Borba Gato, 100, Esplanada Das Bandeiras, Guarulhos/SP, Brasil, 07044-220"
29,NCRI11,Títulos e Val. Mob.,"8,77","10,46%","5,97%","0,86",34.641.500,19.138,0,"0,00","0,00","0,00%","0,00%",
30,OGHY11,Títulos e Val. Mob.,"10,03","5,92%","6,20%","1,04",20.812.200,2.393,0,"0,00","0,00","0,00%","0,00%",
31,ONEF11,Lajes Corporativas,"193,97","5,94%","5,84%","0,84",176.707.000,48.536,1,"25.340,80","1.876,10","7,40%","0,00%","Rua Ministro Jesuino Cardoso, 454, São Paulo- SP"
32,OULG11,Logística,"41,05","4,00%","6,41%","0,61",101.857.000,51.134,2,"1.114,48","100,28","9,00%","0,00%","Rod. Washington Luiz, km 114, Via Projetada Aterial PD04, nº 3777,Lote nº 21 - Distrito Industrial - Bairro Benfica - Juiz de Fora/MG"
33,PATC11,Lajes Corporativas,"73,49","4,30%","5,33%","0,95",255.557.000,879.103,7,"18.627,70","1.062,69","5,70%","2,90%","Rua Ministro Jesuíno Cardoso, 454, Vila Olímpia, São Paulo - SP,Avenida Brigadeiro Faria Lima, 3311, Itaim Bibi, São Paulo - SP.,Rua Fidêncio Ramos, 308, Vila Olímpia, São Paulo - SP,Rua Pascoal Pais, 525 - São Paulo,Alameda Vicente Pinzon, 51, Vila Olímpia, São Paulo - SP,R. Gomes de Carvalho, 1996, Vila Olímpia, São Paulo - SP,Avenida Paulista, 1.842 - São Paulo"
34,PVBI11,Lajes Corporativas,"97,36","2,64%","7,15%","0,95",1.182.170.000,4.008.070,4,"17.807,70","1.333,43","7,49%","0,35%","Avenida Brigadeiro Luis Antonio, 3521, Jardim Paulista, Sao Paulo/SP, Brasil, 01401-001,Rua Leopoldo Couto Magalhães Júnior, 822, Itaim Bibi, São Paulo/SP, Brasil, 04542-000,Rua Fidêncio Ramos, 302, Vila Olímpia, Sao Paulo/SP, Brasil, 04551-010,Avenida Brigadeiro Faria Lima, 4440, Itaim Bibi, São Paulo/SP, Brasil, 04538-132"
35,RBRP11,Outros,"57,50","7,56%","6,86%","0,72",700.303.000,1.094.540,11,"9.271,58","741,59","8,00%","32,32%","Alameda Grajaú, nº 98 – Alphaville Industrial, Barueri/SP,Rua Cincinato Braga, 340 - Bela Vista - São Paulo - SP,Rua Amauri, 299, 311 (lojas) e 305 (entrada), Jardim Paulistano.,Rua Ministro Jesuíno Cardoso 589 x Cel. Joaquim Ferreira Lobo, 360,Rua Gomes de Carvalho, 1.356, São Paulo - SP,Avenida Venezuela, 43 - Saúde - Rio de Janeiro - RJ,Av. República do Chile, 230 – Centro, Rio de Janeiro - RJ,Rua Gerivatiba, esquina com a Rua Pirajussara, nºs 71,
87 e 95, com frente também para a Rua Desembargador Armando Fairbanks, nº 32,
Pinheiros, São Paulo – SP.,Av. Brigadeiro Faria Lima nº 1.461, Pinheiros, São Paulo/SP,Rua Casa do Ator, 1.155 - Vila Olímpia - São Paulo - SP,Avenida João Dias n° 1.645 - Santo Amaro, São Paulo - SP"
36,RCRB11,Lajes Corporativas,"144,00","3,23%","6,09%","0,69",531.460.000,682.458,9,"12.958,00","980,41","7,57%","18,66%","Rua Girassol, 555 – Vila Madalena,Rua da Candelária nº 65, Centro, Rio de Janeiro/RJ,Avenida Paulista, 37, São Paulo/SP,Rua Surubim, 373, Brooklin Novo, São Paulo/SP,Alameda Santos, 1.800 - Jardins,Alameda Santos, 1163, Cerqueira César, São Paulo/SP,Praia do Flamengo nº 154, Flamengo, Rio de Janeiro/RJ,Rua Olimpiadas. 205, São Paulo SP,Av. Juscelino Kubitschek, 510, Itaim Bibi, São Paulo/SP"
37,RMAI11,Híbrido,"48,00","1,64%","6,46%","0,48",117.302.000,59.122,2,"2.809,94","159,88","5,69%","38,25%","Avenida Armando Morais Sarmento, nº 100, Distrito Industrial de Queimados, Cidade de Queimados, Estado do Rio de Janeiro ,Rua José Versolato, 111, Centro, São Bernardo do Campo/SP."
38,RZAT11,Híbrido,"94,81","13,16%","6,25%","0,95",351.571.000,823.538,10,"774,03","65,74","8,49%","0,00%","Rua Professor Luciano Prata 204, São Paulo, SP, 02510-020,Av. Costa e Silva 1275, Campo Grande, MS, 79050-410,Av. Perimetral Norte 10001, Goiânia, GO, 74583-285,Rod. Juscelino Kubitscheck de Oliveira - BR 364, Frutal, MG, 38200-000,Rodovia BR 060 KM 504, Goiânia, GO, 75800-001,Rodovia BR 020 572, Caucaia, CE, 061663-015,Rodovia GO-070, Km 2 Qd. CH, Lt. 444, , Goiânia, GO, 74470-260,Avenida Juscelino Kubitschek De Oliveira, 154, Blocos A, B, C, Centro, Votorantim/SP, Brasil, 18110-901,Rodovia Washington Luis KM 198, Corumbataí, SP, 13540-000,Av. Santos Dumont 4305, Mirassol, SP, 15135-160"
39,SCPF11,Shoppings,"5,19","4,98%","5,09%","0,44",21.798.000,3.369,1,"4.477,47","774,77","17,30%","23,89%","Rua Junqueira Ayres, 165 - Barris - Salvador - BA"
40,SHPH11,Shoppings,"750,00","6,49%","5,88%","0,84",456.713.000,172.085,1,"13.217,20","1.101,84","8,34%","8,95%","Rua Dr. Veiga Filho, 133, Higienópolis, São Paulo - SP"
41,TEPP11,Lajes Corporativas,"85,15","1,93%","7,05%","0,89",359.500.000,908.432,5,"10.479,90","415,40","3,96%","8,35%","Rua Paes Leme, 524, no 45º Subdistrito – Pinheiros, São Paulo – SP,Rua Treze de Maio, nº 1.633 – Bela Vista – São Paulo – SP, Rua Itapeva, nº 538 – Bela Vista – São Paulo, SP,Rua James Joule, 65 - Berrini - São Paulo - SP,Av. Presidente Juscelino Kubitschek, 1830 e Rua Leopoldo Couto de Magalhês Júnior, 1461, no 28º Subdistrito - Jardim Paulista, São Paulo - SP"
42,TRNT11,Lajes Corporativas,"114,90","4,07%","4,05%","0,58",452.196.000,33.284,1,"7.169,44","564,73","7,88%","41,63%","Avenida Das Nacoes Unidas, 12901, Sem Complemento, Brooklin Paulista, São Paulo/SP, Brasil, 04578-910"
43,VILG11,Logística,"105,44","7,27%","7,75%","0,94",1.581.330.000,2.044.900,16,"2.676,10","245,31","9,17%","9,10%","Cidade de Cariacica, n° 10.288, km 290, RD. Governador Mario Covas - ES,Município de Serra, no estado do Espírito Santo,Rodovia Fernão Dias, km 933, Extrema - MG,Av. Marginal Rodovia dos Bandeirantes, Nº 800, Jundiaí - SP,Rodovia Br 316 - KM 23/24
Bairro Campestre - Benevides/PA,Cidade de Eldorado do Sul, na Av. Industrial Belgraf, n° 765 - RS,Avenida das Quaresmeiras, n. 200, Pouso Alegre - MG,Rodovia Armínio Guilherme, 82 – Ipojuca, PE,Cidade Cachoeirinha, Rio Grande do Sul, RS 118, nº 12760,R. Almerim, 100, Guarulhos - SP,Rua Kida, 191 - Guarulhos - São Paulo, Rodovia BR-493 (RioMagé), km 3,5, Duque de Caxias - RJ,Rodovia Fernão Dias, km 891,5, Extrema - MG,Av. Dr. Kenkiti Shimomoto, Nº 1.678, Osasco - SP,Rodovia Castello Branco, km 57, em São Roque, SP,Est. Vargem do João Pinto, Fazenda Matão Gleba 2, Extrema - MG"
44,WTSP11B,Híbrido,"35,05","-16,16%","4,26%","0,48",34.789.400,298,1,"2.849,50","127,16","4,46%","5,69%","Av. das Nações Unidas, 12551, 12555 e 12559"
45,XPLG11,Logística,"112,12","7,57%","7,80%","0,99",3.038.570.000,3.995.140,18,"2.451,10","185,77","7,58%","5,01%","Rua Lennie Queiroz, 333 - Cachoeirinha - RS,Rua Joao de Padula, 245 - Americana - SP,km 26 + 175,35m e o km 25 + 759,35m da Rodovia Anhanguera,ROD BR101, Sul Km 96,4, 5.225 - Cabo de Santo Agostinho, PE,Bairro dos Tenentes no Município de Extrema/MG ,Rod. dos Bandeirantes, km 34,Rod. dos Bandeirantes, km 34 - Cajamar, SP,ROD BR101, Sul Nº 2.220 - Cabo de Santo Agostinho, PE,Estrada Tenente Marques, 1818 - Santana de Parnaiba - SP,Avenida Osvaldo José do Amaral, SN - Areias São José - SC,Bairro dos Tenentes no Município de Extrema/MG ,Estrada Miguel Pereira nº 34, Bairro São Miguel, CEP: 23.890-000,Via Jose Luiz Galvão, 1905 - Ribeirão Preto - SP,Avenida Ceci, 1649 - Barueri - SP,Avenida OL-1 -Duque de Caxias, RJ,Estrada Municipal do Mandu, 2550 - Itapeva - MG,Rod. dos Bandeirantes, km 34,Bairro dos Tenentes no Município de Extrema/MG"
46,YUFI11,Residencial,"80,84","3,91%","4,47%","0,80",39.825.800,943,28,"8.801,58","882,44","10,03%","0,00%","Pc Amadeu Amaral, 84 - Bela Vista, SP,Rua Navarro de Andrade, 320, Pinheiros - SP,Rua Dr. Fausto Ferraz, 115 , Paraíso - SP,Rua Joaquim Antunes, 922, Pinheiros - SP,Rua Acaraú, 51 , Bela Vista - SP,Rua da Consolação, 2143 - Consolação - SP,Rua Bartolomeu Feio, 66, Brooklin - SP,Al. Franca - 270, Jardim Paulista - SP,Av. Paulista, 347, Paraíso - SP,Rua Guilherme Barbosa de Melo, 84, Brooklin - SP,Rua Treze de Maio, 1483, Paraíso - SP,Av. Rebouças, 1480 - Pinheiros, SP,Rua Una, 56, Bela Vista - SP,Rua Dr. Fausto Ferraz, 115 , Paraíso - SP,Al Campos, 1126, Jardim Paulista - SP,Rua Bartolomeu Feio, 66, Brooklin - SP,Al. Gabriel Monteiro da Silva, Jardim América - SP,Rua Paula Ney, 475, Vila Mariana - SP,Rua José do Patrocínio, 645, Aclimação - SP,Av. Brigadeiro Luís Antonio, 1622, Paraíso - SP,Pc Amadeu Amaral, 84 - Bela Vista , SP,Rua Arruda Alvim, 36, Pinheiros - SP,Rua Dr. Fausto Ferraz, 115 , Paraíso - SP,Rua Lisboa, 104, Pinheiros - SP,Rua Treze de Maio, 1412, Bela Vista - SP,Rua Alvorada, 795, Vila Olímpia - SP,Rua Florida, 1350, Cidade Monções - SP,Rua Dr. Plinio Barreto, 249, Bela Vista - SP"
47,ZAVI11,Híbrido,"125,80","5,82%","6,99%","0,99",116.556.000,67.230,8,"2.234,04","163,12","7,30%","1,10%","Rodovia Contorno Norte, nº 305, Colombo-PR, CEP 83402-335,Rua Tabapuã, 41, Itaim Bibi, São Paulo - SP, CEP 04533-010, Rua Attílio Bilibio, nº 685, Nova Bassano - RS, CEP 95340-000,Avenida Andrômeda, 1669, Jardim Satélite, São José dos Campos - SP, CEP 12230-000,Rua Santa Luzia, 579, Vila Santa Luzia, Taboão da Serra - SP, CEP 06754-005,Avenida Andrômeda, 1679, Jardim Satélite, São José dos Campos - SP, CE: 12230-000,Av. Moita Bonita, nº 266, Guarulhos - SP, CEP 07270-395,Rua Proessor Sarmento Barata, nº 297, Porto Alegre-RS, CEP 90240-640."
